[
    {
        "direction": "Directions to SolveIn each of the following questions two statements are given and these statements are followed by two conclusions numbered (1) and (2). You have to take the given two statements to be true even if they seem to be at variance from commonly known facts. Read the conclusions and then decide which of the given conclusions logically follows from the two given statements, disregarding commonly known facts.Give answer:(A) If only (1) conclusion follows(B) If only (2) conclusion follows(C) If either (1) or (2) follows(D) If neither (1) nor (2) follows and(E) If both (1) and (2) follow.",
        "image_path": null,
        "question": "Statements:All the actors are girls. All the girls are beautiful.Conclusions:All the actors are beautiful.Some girls are actors.",
        "options": {
            "A": "Only (1) conclusion follows",
            "B": "Only (2) conclusion follows",
            "C": "Either (1) or (2) follows",
            "D": "Neither (1) nor (2) follows",
            "E": "Both (1) and (2) follow"
        },
        "correct_answer": "E",
        "answer_description": ""
    },
    {
        "direction": "Directions to SolveIn each of the following questions two statements are given and these statements are followed by two conclusions numbered (1) and (2). You have to take the given two statements to be true even if they seem to be at variance from commonly known facts. Read the conclusions and then decide which of the given conclusions logically follows from the two given statements, disregarding commonly known facts.Give answer:(A) If only (1) conclusion follows(B) If only (2) conclusion follows(C) If either (1) or (2) follows(D) If neither (1) nor (2) follows and(E) If both (1) and (2) follow.",
        "image_path": null,
        "question": "Statements:All the windows are doors. No door is a wall.Conclusions:Some windows are walls.No wall is a door.",
        "options": {
            "A": "Only (1) conclusion follows",
            "B": "Only (2) conclusion follows",
            "C": "Either (1) or (2) follows",
            "D": "Neither (1) nor (2) follows",
            "E": "Both (1) and (2) follow"
        },
        "correct_answer": "B",
        "answer_description": ""
    },
    {
        "direction": "Directions to SolveIn each of the following questions two statements are given and these statements are followed by two conclusions numbered (1) and (2). You have to take the given two statements to be true even if they seem to be at variance from commonly known facts. Read the conclusions and then decide which of the given conclusions logically follows from the two given statements, disregarding commonly known facts.Give answer:(A) If only (1) conclusion follows(B) If only (2) conclusion follows(C) If either (1) or (2) follows(D) If neither (1) nor (2) follows and(E) If both (1) and (2) follow.",
        "image_path": null,
        "question": "Statements:All cups are books. All books are shirts.Conclusions:Some cups are not shirts.Some shirts are cups.",
        "options": {
            "A": "Only (1) conclusion follows",
            "B": "Only (2) conclusion follows",
            "C": "Either (1) or (2) follows",
            "D": "Neither (1) nor (2) follows",
            "E": "Both (1) and (2) follow"
        },
        "correct_answer": "B",
        "answer_description": ""
    },
    {
        "direction": "Directions to SolveIn each of the following questions two statements are given and these statements are followed by two conclusions numbered (1) and (2). You have to take the given two statements to be true even if they seem to be at variance from commonly known facts. Read the conclusions and then decide which of the given conclusions logically follows from the two given statements, disregarding commonly known facts.Give answer:(A) If only (1) conclusion follows(B) If only (2) conclusion follows(C) If either (1) or (2) follows(D) If neither (1) nor (2) follows and(E) If both (1) and (2) follow.",
        "image_path": null,
        "question": "Statements:Some cows are crows. Some crows are elephants.Conclusions:Some cows are elephants.All crows are elephants.",
        "options": {
            "A": "Only (1) conclusion follows",
            "B": "Only (2) conclusion follows",
            "C": "Either (1) or (2) follows",
            "D": "Neither (1) nor (2) follows",
            "E": "Both (1) and (2) follow"
        },
        "correct_answer": "D",
        "answer_description": ""
    },
    {
        "direction": "Directions to SolveIn each of the following questions two statements are given and these statements are followed by two conclusions numbered (1) and (2). You have to take the given two statements to be true even if they seem to be at variance from commonly known facts. Read the conclusions and then decide which of the given conclusions logically follows from the two given statements, disregarding commonly known facts.Give answer:(A) If only (1) conclusion follows(B) If only (2) conclusion follows(C) If either (1) or (2) follows(D) If neither (1) nor (2) follows and(E) If both (1) and (2) follow.",
        "image_path": null,
        "question": "Statements:All the pencils are pens. All the pens are inks.Conclusions:All the pencils are inks.Some inks are pencils.",
        "options": {
            "A": "Only (1) conclusion follows",
            "B": "Only (2) conclusion follows",
            "C": "Either (1) or (2) follows",
            "D": "Neither (1) nor (2) follows",
            "E": "Both (1) and (2) follow"
        },
        "correct_answer": "E",
        "answer_description": ""
    }
]