[
    {
        "direction": "Directions to SolveIn each of the following questions two statements are given and these statements are followed by two conclusions numbered (1) and (2). You have to take the given two statements to be true even if they seem to be at variance from commonly known facts. Read the conclusions and then decide which of the given conclusions logically follows from the two given statements, disregarding commonly known facts.Give answer:(A) If only (1) conclusion follows(B) If only (2) conclusion follows(C) If either (1) or (2) follows(D) If neither (1) nor (2) follows and(E) If both (1) and (2) follow.",
        "image_path": null,
        "question": "Statements:Some actors are singers. All the singers are dancers.Conclusions:Some actors are dancers.No singer is actor.",
        "options": {
            "A": "Only (1) conclusion follows",
            "B": "Only (2) conclusion follows",
            "C": "Either (1) or (2) follows",
            "D": "Neither (1) nor (2) follows",
            "E": "Both (1) and (2) follow"
        },
        "correct_answer": "A",
        "answer_description": ""
    },
    {
        "direction": "Directions to SolveIn each of the following questions two statements are given and these statements are followed by two conclusions numbered (1) and (2). You have to take the given two statements to be true even if they seem to be at variance from commonly known facts. Read the conclusions and then decide which of the given conclusions logically follows from the two given statements, disregarding commonly known facts.Give answer:(A) If only (1) conclusion follows(B) If only (2) conclusion follows(C) If either (1) or (2) follows(D) If neither (1) nor (2) follows and(E) If both (1) and (2) follow.",
        "image_path": null,
        "question": "Statements:All the harmoniums are instruments. All the instruments are flutes.Conclusions:All the flutes are instruments.All the harmoniums are flutes.",
        "options": {
            "A": "Only (1) conclusion follows",
            "B": "Only (2) conclusion follows",
            "C": "Either (1) or (2) follows",
            "D": "Neither (1) nor (2) follows",
            "E": "Both (1) and (2) follow"
        },
        "correct_answer": "B",
        "answer_description": ""
    },
    {
        "direction": "Directions to SolveIn each of the following questions two statements are given and these statements are followed by two conclusions numbered (1) and (2). You have to take the given two statements to be true even if they seem to be at variance from commonly known facts. Read the conclusions and then decide which of the given conclusions logically follows from the two given statements, disregarding commonly known facts.Give answer:(A) If only (1) conclusion follows(B) If only (2) conclusion follows(C) If either (1) or (2) follows(D) If neither (1) nor (2) follows and(E) If both (1) and (2) follow.",
        "image_path": null,
        "question": "Statements:Some mangoes are yellow. Some tixo are mangoes.Conclusions:Some mangoes are green.Tixo is a yellow.",
        "options": {
            "A": "Only (1) conclusion follows",
            "B": "Only (2) conclusion follows",
            "C": "Either (1) or (2) follows",
            "D": "Neither (1) nor (2) follows",
            "E": "Both (1) and (2) follow"
        },
        "correct_answer": "D",
        "answer_description": ""
    },
    {
        "direction": "Directions to SolveIn each of the following questions two statements are given and these statements are followed by two conclusions numbered (1) and (2). You have to take the given two statements to be true even if they seem to be at variance from commonly known facts. Read the conclusions and then decide which of the given conclusions logically follows from the two given statements, disregarding commonly known facts.Give answer:(A) If only (1) conclusion follows(B) If only (2) conclusion follows(C) If either (1) or (2) follows(D) If neither (1) nor (2) follows and(E) If both (1) and (2) follow.",
        "image_path": null,
        "question": "Statements:Some ants are parrots. All the parrots are apples.Conclusions:All the apples are parrots.Some ants are apples.",
        "options": {
            "A": "Only (1) conclusion follows",
            "B": "Only (2) conclusion follows",
            "C": "Either (1) or (2) follows",
            "D": "Neither (1) nor (2) follows",
            "E": "Both (1) and (2) follow"
        },
        "correct_answer": "B",
        "answer_description": ""
    },
    {
        "direction": "Directions to SolveIn each of the following questions two statements are given and these statements are followed by two conclusions numbered (1) and (2). You have to take the given two statements to be true even if they seem to be at variance from commonly known facts. Read the conclusions and then decide which of the given conclusions logically follows from the two given statements, disregarding commonly known facts.Give answer:(A) If only (1) conclusion follows(B) If only (2) conclusion follows(C) If either (1) or (2) follows(D) If neither (1) nor (2) follows and(E) If both (1) and (2) follow.",
        "image_path": null,
        "question": "Statements:Some papers are pens. All the pencils are pens.Conclusions:Some pens are pencils.Some pens are papers.",
        "options": {
            "A": "Only (1) conclusion follows",
            "B": "Only (2) conclusion follows",
            "C": "Either (1) or (2) follows",
            "D": "Neither (1) nor (2) follows",
            "E": "Both (1) and (2) follow"
        },
        "correct_answer": "E",
        "answer_description": ""
    }
]